{
  "$id": "https://paperos.dev/schemas/quality/mutation.schema.json",
  "title": "GateReport<mutation>",
  "description": "reports/mutation.json (PAP-686): nightly mutation scores and survivors per package. Envelope version 1.",
  "$schema": "https://json-schema.org/draft/2020-12/schema",
  "type": "object",
  "properties": {
    "kind": {
      "type": "string",
      "const": "mutation"
    },
    "version": {
      "type": "number",
      "const": 1
    },
    "sha": {
      "type": "string",
      "pattern": "^[0-9a-f]{7,40}$"
    },
    "pr": {
      "type": "integer",
      "exclusiveMinimum": 0,
      "maximum": 9007199254740991
    },
    "startedAt": {
      "type": "string",
      "format": "date-time",
      "pattern": "^(?:(?:\\d\\d[2468][048]|\\d\\d[13579][26]|\\d\\d0[48]|[02468][048]00|[13579][26]00)-02-29|\\d{4}-(?:(?:0[13578]|1[02])-(?:0[1-9]|[12]\\d|3[01])|(?:0[469]|11)-(?:0[1-9]|[12]\\d|30)|(?:02)-(?:0[1-9]|1\\d|2[0-8])))T(?:(?:[01]\\d|2[0-3]):[0-5]\\d:[0-5]\\d(?:\\.\\d+)?(?:Z))$"
    },
    "finishedAt": {
      "type": "string",
      "format": "date-time",
      "pattern": "^(?:(?:\\d\\d[2468][048]|\\d\\d[13579][26]|\\d\\d0[48]|[02468][048]00|[13579][26]00)-02-29|\\d{4}-(?:(?:0[13578]|1[02])-(?:0[1-9]|[12]\\d|3[01])|(?:0[469]|11)-(?:0[1-9]|[12]\\d|30)|(?:02)-(?:0[1-9]|1\\d|2[0-8])))T(?:(?:[01]\\d|2[0-3]):[0-5]\\d:[0-5]\\d(?:\\.\\d+)?(?:Z))$"
    },
    "status": {
      "type": "string",
      "enum": [
        "pass",
        "fail",
        "error",
        "skipped"
      ]
    },
    "findings": {
      "type": "array",
      "items": {
        "type": "object",
        "properties": {
          "id": {
            "type": "string",
            "pattern": "^[0-9a-f]{10}$"
          },
          "reviewer": {
            "type": "string",
            "minLength": 1
          },
          "rubricId": {
            "type": "string",
            "pattern": "^RUB-(COR|SEC|SPEC|VIS|A11Y|PERF|DOC|AGENT)-\\d{2}$"
          },
          "severity": {
            "type": "string",
            "enum": [
              "S0",
              "S1",
              "S2",
              "S3",
              "question",
              "praise"
            ]
          },
          "title": {
            "type": "string",
            "minLength": 1,
            "maxLength": 200
          },
          "body": {
            "type": "string",
            "minLength": 1
          },
          "file": {
            "type": "string",
            "minLength": 1
          },
          "line": {
            "type": "integer",
            "exclusiveMinimum": 0,
            "maximum": 9007199254740991
          },
          "endLine": {
            "type": "integer",
            "exclusiveMinimum": 0,
            "maximum": 9007199254740991
          },
          "suggestion": {
            "type": "string"
          },
          "evidence": {
            "type": "array",
            "items": {
              "type": "object",
              "properties": {
                "kind": {
                  "type": "string",
                  "enum": [
                    "code",
                    "screenshot",
                    "video",
                    "log",
                    "sarif",
                    "report"
                  ]
                },
                "ref": {
                  "type": "string",
                  "minLength": 1
                }
              },
              "required": [
                "kind",
                "ref"
              ]
            }
          },
          "confidence": {
            "type": "number",
            "minimum": 0,
            "maximum": 1
          },
          "autofixable": {
            "type": "boolean"
          },
          "waiver": {
            "type": "object",
            "properties": {
              "reason": {
                "type": "string",
                "minLength": 1
              },
              "approvedBy": {
                "type": "string",
                "minLength": 1
              },
              "expires": {
                "type": "string",
                "format": "date",
                "pattern": "^(?:(?:\\d\\d[2468][048]|\\d\\d[13579][26]|\\d\\d0[48]|[02468][048]00|[13579][26]00)-02-29|\\d{4}-(?:(?:0[13578]|1[02])-(?:0[1-9]|[12]\\d|3[01])|(?:0[469]|11)-(?:0[1-9]|[12]\\d|30)|(?:02)-(?:0[1-9]|1\\d|2[0-8])))$"
              }
            },
            "required": [
              "reason",
              "approvedBy",
              "expires"
            ]
          }
        },
        "required": [
          "id",
          "reviewer",
          "rubricId",
          "severity",
          "title",
          "body",
          "evidence",
          "confidence",
          "autofixable"
        ],
        "additionalProperties": false
      }
    },
    "summary": {
      "type": "string",
      "minLength": 1
    },
    "artifacts": {
      "type": "array",
      "items": {
        "type": "object",
        "properties": {
          "kind": {
            "type": "string",
            "enum": [
              "screenshot",
              "video",
              "report",
              "log",
              "sarif"
            ]
          },
          "path": {
            "type": "string",
            "minLength": 1
          },
          "url": {
            "type": "string",
            "format": "uri"
          },
          "sha256": {
            "type": "string",
            "pattern": "^[0-9a-f]{64}$"
          },
          "expiresAt": {
            "type": "string",
            "format": "date-time",
            "pattern": "^(?:(?:\\d\\d[2468][048]|\\d\\d[13579][26]|\\d\\d0[48]|[02468][048]00|[13579][26]00)-02-29|\\d{4}-(?:(?:0[13578]|1[02])-(?:0[1-9]|[12]\\d|3[01])|(?:0[469]|11)-(?:0[1-9]|[12]\\d|30)|(?:02)-(?:0[1-9]|1\\d|2[0-8])))T(?:(?:[01]\\d|2[0-3]):[0-5]\\d:[0-5]\\d(?:\\.\\d+)?(?:Z))$"
          }
        },
        "required": [
          "kind",
          "path"
        ],
        "additionalProperties": false
      }
    },
    "producer": {
      "type": "object",
      "properties": {
        "id": {
          "type": "string",
          "format": "uuid",
          "pattern": "^([0-9a-fA-F]{8}-[0-9a-fA-F]{4}-[1-8][0-9a-fA-F]{3}-[89abAB][0-9a-fA-F]{3}-[0-9a-fA-F]{12}|00000000-0000-0000-0000-000000000000|ffffffff-ffff-ffff-ffff-ffffffffffff)$"
        },
        "type": {
          "type": "string",
          "enum": [
            "human",
            "agent",
            "service",
            "anonymous"
          ]
        },
        "character": {
          "type": "string",
          "minLength": 1,
          "maxLength": 64
        }
      },
      "required": [
        "id",
        "type"
      ],
      "additionalProperties": false
    },
    "data": {
      "type": "object",
      "properties": {
        "packages": {
          "type": "array",
          "items": {
            "type": "object",
            "properties": {
              "name": {
                "type": "string",
                "minLength": 1
              },
              "score": {
                "type": "number",
                "minimum": 0,
                "maximum": 100
              },
              "floor": {
                "type": "number",
                "minimum": 0,
                "maximum": 100
              },
              "killed": {
                "type": "integer",
                "minimum": 0,
                "maximum": 9007199254740991
              },
              "survived": {
                "type": "integer",
                "minimum": 0,
                "maximum": 9007199254740991
              },
              "timeout": {
                "type": "integer",
                "minimum": 0,
                "maximum": 9007199254740991
              },
              "noCoverage": {
                "type": "integer",
                "minimum": 0,
                "maximum": 9007199254740991
              },
              "survivors": {
                "type": "array",
                "items": {
                  "type": "object",
                  "properties": {
                    "file": {
                      "type": "string",
                      "minLength": 1
                    },
                    "line": {
                      "type": "integer",
                      "exclusiveMinimum": 0,
                      "maximum": 9007199254740991
                    },
                    "mutator": {
                      "type": "string",
                      "minLength": 1
                    }
                  },
                  "required": [
                    "file",
                    "line",
                    "mutator"
                  ],
                  "additionalProperties": false
                }
              }
            },
            "required": [
              "name",
              "score",
              "floor",
              "killed",
              "survived",
              "timeout",
              "noCoverage",
              "survivors"
            ],
            "additionalProperties": false
          }
        },
        "reportUrl": {
          "type": "string",
          "format": "uri"
        }
      },
      "required": [
        "packages"
      ],
      "additionalProperties": false
    }
  },
  "required": [
    "kind",
    "version",
    "sha",
    "startedAt",
    "finishedAt",
    "status",
    "findings",
    "summary",
    "artifacts",
    "data"
  ],
  "additionalProperties": false
}
